Wavy Salted Potato Chips,11 oz (Previously Happy Belly + Packaging May Vary),1,100,3.49,1
Amazon Basics Swivel Foam Lounge Chair, Adjustable with headrest and grey,1,1,132.99,2
Apple iPhone 11, 64GB Black - Unlocked,2,1,249.99,3 
HydroFlask, 21 fluid oz,2,50,34.50,4
Disposable White Uncoated Paper Plates,9 Inch Large Decorative Craft Paper Plates,3,10,8.75,5
Crest Complete Active Fresh + Whitening Toothpaste, 5.5oz (Pack of 4),3,30,5.55,6
Lightweight Casual Laptop Backpack,Backpack with USB Charging Port + Men and Women + One pocket backpack,4,5,16.99,7
AirPods Case Cover,Silicone Protective Skin Apple Airpod Case 2nd &1st Generation,4,20,8.49,8
